"sep=,"
"Well Crafted Wine & Beverage Co.","Hertelendy Chardonnay 2017",17983,CAL1279,,,14.70,750.000,ml,12,121.000
"Well Crafted Wine & Beverage Co.","Hertelendy Chardonnay 2018",18054,CAL1167,,,14.70,750.000,ml,12,8.000
"Well Crafted Wine & Beverage Co.","Hertelendy Chardonnay 2021",30117,CAL1167,,,14.70,750.000,ml,12,59.000
"Well Crafted Wine & Beverage Co.","Hertelendy Legend 2018",21111,CAL1227,,,14.70,750.000,ml,6,2.000
"Well Crafted Wine & Beverage Co.","Hertelendy Legend 2019",24600,CAL1227,,,14.70,750.000,ml,6,32.000
"Well Crafted Wine & Beverage Co.","Hertelendy Signature Mountain Blend (12 pk) 2017",15568,CAL1166,,,14.70,750.000,ml,12,24.000
"Well Crafted Wine & Beverage Co.","High Camp Cabernet Sauvignon 2021",23381,CAL1337,,,14.10,750.000,ml,12,294.000
"Well Crafted Wine & Beverage Co.","Hightower Red Blend",10104,WAS1020,,,,750.000,ml,12,
"Well Crafted Wine & Beverage Co.","Huteau Boulanger Gamay 2023",24762,FRA1165,,,,750.000,ml,12,330.000
"Well Crafted Wine & Beverage Co.","Inventory Pick Up",28272,,,,,1.000,each,1,-116.000
"Well Crafted Wine & Beverage Co.","Inversa Bergamot Lemon   250 ml",21352,ITA1089,,,7.00,250.000,ml,24,850.000
"Well Crafted Wine & Beverage Co.","Inversa Morello Cherry   250 ml",21353,ITA1090,,,7.00,250.000,ml,24,0.000
"Well Crafted Wine & Beverage Co.","Inversa Peach Basil   250 ml",21354,ITA1091,,,7.00,250.000,ml,24,0.000
"Well Crafted Wine & Beverage Co.","Jardin de Paradis Bordeaux Superior  Mevushal (MD & DC)",23872,FRA1152,,,,750.000,ml,12,0.000
"Well Crafted Wine & Beverage Co.","Jardin de Paradis Sweet Semillon Mevushal (MD & DC)",23914,FRA1154,,,,750.000,ml,12,0.000
"Well Crafted Wine & Beverage Co.","Jardin Enchante Sauvignon Blanc Mevushal (MD & DC)",23935,FRA1159,,,,750.000,ml,12,0.000
"Well Crafted Wine & Beverage Co.","Jean Leon 3055 Chardonnay 2023",25536,SPA1304,,,13.50,750.000,ml,12,45.000
"Well Crafted Wine & Beverage Co.","Jean Leon 3055 Chardonnay 2024",29286,SPA1304,,,13.50,750.000,ml,12,186.000
"Well Crafted Wine & Beverage Co.","Jean Leon 3055 Red Blend 2022",23722,SPA1306,,,13.50,750.000,ml,12,17.000
"Well Crafted Wine & Beverage Co.","Jean Leon 3055 Red Blend 2023",29287,SPA1306,,,13.50,750.000,ml,12,72.000
"Well Crafted Wine & Beverage Co.","Jean Leon 3055 Rose 2023",24075,SPA1305,,,12.00,750.000,ml,12,57.000
"Well Crafted Wine & Beverage Co.","Jean Leon 3055 Rose 2024",30332,SPA1305,,,12.00,750.000,ml,12,24.000
"Well Crafted Wine & Beverage Co.","Jean Leon Gigi Chardonnay 2023",28411,SPA1351,,,13.50,750.000,ml,12,12.000
"Well Crafted Wine & Beverage Co.","Jean Leon La Scala Cabernet Sauvignon 2016",23723,SPA1308,,,14.50,750.000,ml,3,36.000
"Well Crafted Wine & Beverage Co.","Jean Leon Le Havre Cabernet Sauvigon 2020",23724,SPA1307,,,14.50,750.000,ml,6,175.000
"Well Crafted Wine & Beverage Co.","Jean Leon Vinya La Scala Cabernet Sauvignon Gran Reserva 2000",24565,SPA1336,,,,750.000,ml,6,18.000
"Well Crafted Wine & Beverage Co.","Jean Leon Vinya La Scala Cabernet Sauvignon Reserva Magnum 1999  1500 ml",24566,SPA1335,,,,1500.000,ml,6,36.000
"Well Crafted Wine & Beverage Co.","Jean Michel Champagne Rose Brut Mevushal",25293,FRA1179,,,,750.000,ml,12,0.000
"Well Crafted Wine & Beverage Co.","Jeff Cohn Cellars St Peters Church Zinfandel 2019",24725,CAL1347,,,,750.000,ml,12,100.000
"Well Crafted Wine & Beverage Co.","Jeff Cohn Cellars Les Inseparables 2022",24634,CAL1345,,,,750.000,ml,12,51.000
"Well Crafted Wine & Beverage Co.","Jeff Cohn Cellars Pure Pink Rose 2023",24635,CAL1346,,,,750.000,ml,12,-1.000
"Well Crafted Wine & Beverage Co.","Jeff Cohn Rossi Zinfandel 2018",17809,CAL1294,,,15.60,750.000,ml,12,1.000
"Well Crafted Wine & Beverage Co.","Jeff Cohn Domaine des Chirats Syrah 2019",24728,CAL1290,,,15.20,750.000,ml,12,28.000
"Well Crafted Wine & Beverage Co.","Jeff Cohn Pure Yum Blend 2018",17807,CAL1292,,,15.20,750.000,ml,12,99.000
"Well Crafted Wine & Beverage Co.","Jeff Cohn Pure Yum Blend 2023",24727,CAL1292,,,15.20,750.000,ml,12,0.000
"Well Crafted Wine & Beverage Co.","Jeff Cohn Rockpile Vineyard Syrah ""Haley"" 2018",20787,CAL1311,,,15.00,750.000,ml,12,0.000
"Well Crafted Wine & Beverage Co.","Jeff Cohn Smoke & Mirrors Red Blend 2018",20788,CAL1313,,,14.90,750.000,ml,12,1.000
"Well Crafted Wine & Beverage Co.","Jeff Cohn Smoke & Mirrors Red Blend 2019",24726,CAL1313,,,14.90,750.000,ml,12,93.000
"Well Crafted Wine & Beverage Co.","Jeff Cohn Stagecoach Viognier 2021",20785,CAL1312,,,15.00,750.000,ml,12,11.000
"Well Crafted Wine & Beverage Co.","Jeff Cohn Sweetwater Springs Petite Sirah 2017",17808,CAL1293,,,15.50,750.000,ml,12,28.000
"Well Crafted Wine & Beverage Co.","Jeremy Nickel Cellars Cabernet Sauvignon 2018",21110,CAL1319,,,14.50,750.000,ml,6,63.000
"Well Crafted Wine & Beverage Co.","Jeremy Nickel Cellars Cabernet Sauvignon 2021",30296,CAL1319,,,14.50,750.000,ml,6,4.000
"Well Crafted Wine & Beverage Co.","Jeremy Nickel Cellars Chardonnay 2018",21109,CAL1318,,,14.50,750.000,ml,12,4.000
"Well Crafted Wine & Beverage Co.","Jeremy Nickel Cellars Chardonnay 2019",21604,CAL1318,,,14.50,750.000,ml,12,99.000
"Well Crafted Wine & Beverage Co.","Jeremy Nickel Cellars Sauvignon Blanc 2024",30297,CAL1391,,,14.50,750.000,ml,12,2.000
"Well Crafted Wine & Beverage Co.","Jump Mountain Borderland 2021",27564,VIR1075,,,12.00,750.000,ml,12,110.000
"Well Crafted Wine & Beverage Co.","Jump Mountain Cabernet Sauvignon 2021",27563,VIR1074,,,13.50,750.000,ml,12,71.000
"Well Crafted Wine & Beverage Co.","Jump Mountain Gruner Veltliner NV",30472,VIR1070,,,11.00,750.000,ml,12,120.000
"Well Crafted Wine & Beverage Co.","Jump Mountain Livia Red Blend 2019",28919,VIR1073,,,12.00,750.000,ml,12,48.000
"Well Crafted Wine & Beverage Co.","Jump Mountain Mountain Mist Rose 2021",27562,VIR1072,,,,750.000,ml,12,0.000
"Well Crafted Wine & Beverage Co.","Jump Mountain Sparkling Gruner Veltliner 2021",27561,VIR1071,,,12.00,750.000,ml,12,86.000
"Well Crafted Wine & Beverage Co.","Keg Deposit (Credited Back Upon Collection)",9231,,,,,,,1,-8.000
"Well Crafted Wine & Beverage Co.","Kelvin Feku Grenache Noir 2022",29298,SAF1120,,,13.00,750.000,ml,12,356.000
"Well Crafted Wine & Beverage Co.","Kerem Ben Zimra Cabernet Sauvignon 2019",17071,,,,,750.000,ml,12,1.000
"Well Crafted Wine & Beverage Co.","Kettlebell Cabernet Sauvignon 2022",25324,CAL1348,,,13.50,750.000,ml,12,3.000
"Well Crafted Wine & Beverage Co.","Kettlebell Cabernet Sauvignon 2023",25747,CAL1348,,,13.50,750.000,ml,12,483.000
"Well Crafted Wine & Beverage Co.","KeyKeg Tap",8905,,,,,1.000,each,1,1.000
"Well Crafted Wine & Beverage Co.","Kitron Cabernet Sauvignon Reserve",25296,ISR1031,,,,750.000,ml,6,0.000
"Well Crafted Wine & Beverage Co.","Knuttel Family Wines Tentadora Malbec 2017",15820,ARG1030,"Knuttel Family",,,750.000,ml,12,11.000
"Well Crafted Wine & Beverage Co.","Knuttel Family Wines Tentadora Malbec 2018",18227,ARG1030,"Knuttel Family",,,750.000,ml,12,1.000
"Well Crafted Wine & Beverage Co.","Knuttel Family Wines Tentadora Malbec 2019",23517,ARG1030,"Knuttel Family",,,750.000,ml,12,464.000
"Well Crafted Wine & Beverage Co.","Knuttel Family Wines Tentadora Malbec STAINED LABEL 2019",28624,ARG1030,"Knuttel Family",,,750.000,ml,12,6.000
"Well Crafted Wine & Beverage Co.","Knuttel Family Dry Creek Valley Cabernet Sauvignon, Sebastian's Infinite Limits 2021",25972,CAL1148,"Knuttel Family",,14.50,750.000,ml,12,584.000
"Well Crafted Wine & Beverage Co.","Knuttel Family Russian River Valley Chardonnay, Kate's Pas de Deux 2020",15265,CAL1150,"Knuttel Family",,13.90,750.000,ml,12,3.000
"Well Crafted Wine & Beverage Co.","Knuttel Family Russian River Valley Chardonnay, Kate's Pas de Deux 2021",19542,CAL1150,"Knuttel Family",,13.90,750.000,ml,12,6.000
"Well Crafted Wine & Beverage Co.","Knuttel Family Russian River Valley Chardonnay, Kate's Pas de Deux 2022",23515,CAL1150,"Knuttel Family",,13.90,750.000,ml,12,2.000
"Well Crafted Wine & Beverage Co.","Knuttel Family Russian River Valley Chardonnay, Kate's Pas de Deux 2023",24800,CAL1150,"Knuttel Family",,13.90,750.000,ml,12,175.000
"Well Crafted Wine & Beverage Co.","Knuttel Family Russian River Valley Chardonnay, Kate's Pas de Deux 2024",30347,CAL1150,"Knuttel Family",,13.90,750.000,ml,12,300.000
"Well Crafted Wine & Beverage Co.","Knuttel Family Sonoma Coast Pinot Noir, Bill's Hidden Track 2018",14528,CAL1149,"Knuttel Family",,13.90,750.000,ml,12,0.000
"Well Crafted Wine & Beverage Co.","Knuttel Family Sonoma Coast Pinot Noir, Bill's Hidden Track 2019",17045,CAL1149,"Knuttel Family",,14.50,750.000,ml,12,0.000
"Well Crafted Wine & Beverage Co.","Knuttel Family Sonoma Coast Pinot Noir, Bill's Hidden Track 2021",22287,CAL1149,"Knuttel Family",,14.50,750.000,ml,12,0.000
"Well Crafted Wine & Beverage Co.","Knuttel Family Sonoma Coast Pinot Noir, Bill's Hidden Track 2022",28749,CAL1149,"Knuttel Family",,14.50,750.000,ml,12,300.000
"Well Crafted Wine & Beverage Co.","Knuttel Family Zinfinity 2018",11880,CAL1151,"Knuttel Family",,13.90,750.000,ml,12,205.000
"Well Crafted Wine & Beverage Co.","Koquelicot Cuvee Santa Chiara 2013",16996,,,,,750.000,ml,12,1.000
"Well Crafted Wine & Beverage Co.","Korde Pinea Blanco 2022-2023",25097,SPA1266,,,12.50,750.000,ml,6,14.000
"Well Crafted Wine & Beverage Co.","Korde Pinea Blanco 2023-2024",30304,SPA1266,,,12.50,750.000,ml,6,60.000
"Well Crafted Wine & Beverage Co.","Korde Pinea El Castillo Red 2023",30308,SPA1368,,,14.00,750.000,ml,6,24.000
"Well Crafted Wine & Beverage Co.","Korde Pinea Rose 2021",17650,SPA1229,,,14.00,750.000,ml,6,8.000
"Well Crafted Wine & Beverage Co.","Korde Pinea Rose 2023",30305,SPA1229,,,14.00,750.000,ml,6,36.000
"Well Crafted Wine & Beverage Co.","Korde Pinea Tinto 2022",25082,SPA1338,,,13.50,750.000,ml,12,5.000
"Well Crafted Wine & Beverage Co.","Korde Pinea Tinto 2023",30306,SPA1338,,,,750.000,ml,12,24.000
"Well Crafted Wine & Beverage Co.","Krs Orange Zilavka 2017",16999,,,,,750.000,ml,12,1.000
"Well Crafted Wine & Beverage Co.","La Domitienne Carignan Vieilles Vignes 2020",18219,SAMPLE,,,,750.000,ml,12,1.000
"Well Crafted Wine & Beverage Co.","La Domitienne Carignan Vieilles Vignes 2022",23878,FRA1079,,,13.50,750.000,ml,12,85.000
"Well Crafted Wine & Beverage Co.","La Domitienne Mourvedre Rose 2021",16863,FRA1057,"Jeff Welburn Selections",,,750.000,ml,12,39.000
"Well Crafted Wine & Beverage Co.","La Domitienne Picpoul 2023",25537,FRA1058,,,13.00,750.000,ml,12,174.000
"Well Crafted Wine & Beverage Co.","La Floret D Vir Pinot Noir (MD & DC)",23930,ISR1014,,,,750.000,ml,12,0.000
"Well Crafted Wine & Beverage Co.","La Foret Blanche Talpiot 2019",17072,,,,,750.000,ml,12,1.000
"Well Crafted Wine & Beverage Co.","La Mancha Vega Demara Crianza 2012",3177,SPA1041,,,13.50,750.000,ml,12,
"Well Crafted Wine & Beverage Co.","La Mancha Vega Demara Joven 2017",3176,SPA1040,,,13.50,750.000,ml,12,1.000
"Well Crafted Wine & Beverage Co.","La Petite Mort Gentil Qvevri (White) 2020",18293,AUS1023,,,11.50,750.000,ml,12,60.000
"Well Crafted Wine & Beverage Co.","La Petite Mort Saperavi Qvervi (Red) 2020",18294,AUS1025,,,13.20,750.000,ml,12,20.000
"Well Crafted Wine & Beverage Co.","La Petite Mort VMR Qvevri 2019",18295,AUS1024,,,13.00,750.000,ml,12,4.000
"Well Crafted Wine & Beverage Co.","La Sala Red Sangria",10117,SPA1220,,,,750.000,ml,12,
"Well Crafted Wine & Beverage Co.","La Sala Rose Sangria",10119,SPA1222,,,,750.000,ml,12,6.000
"Well Crafted Wine & Beverage Co.","Lambert Estate A Thousand Words Chardonnay 2023",25989,AUS1037,,,,750.000,ml,12,23.000
"Well Crafted Wine & Beverage Co.","Lambert Estate A Thousand Words Chardonnay 2024",29398,AUS1037,,,,750.000,ml,12,72.000
"Well Crafted Wine & Beverage Co.","Lambert Estate Black Sheep Red Blend 2020",25988,AUS1003,,,14.50,750.000,ml,12,6.000
"Well Crafted Wine & Beverage Co.","Lambert Estate Black Sheep Red Blend 2022",28905,AUS1003,,,14.50,750.000,ml,12,227.000
"Well Crafted Wine & Beverage Co.","Lambert Estate Chocolatier NV",15737,AUS1005,,,17.00,750.000,ml,12,523.000
"Well Crafted Wine & Beverage Co.","Lambert Estate Commitment Shiraz 2018",15739,AUS1002,,,15.00,750.000,ml,12,98.000
"Well Crafted Wine & Beverage Co.","Lambert Estate First Chapter Shiraz 2019",15740,AUS1004,,,14.50,750.000,ml,12,0.000
"Well Crafted Wine & Beverage Co.","Lambert Estate First Chapter Shiraz 2021",25643,AUS1004,,,14.50,750.000,ml,12,3.000
"Well Crafted Wine & Beverage Co.","Lambert Estate First Chapter Shiraz 2023",28906,AUS1004,,,14.50,750.000,ml,12,206.000
"Well Crafted Wine & Beverage Co.","Lambert Estate Thoroughbred Cabernet Sauvignon 2019",27671,AUS1001,,,15.00,750.000,ml,12,230.000
"Well Crafted Wine & Beverage Co.","Lame Delisle Boucard Bourgueil Vieilles Vignes 2018",18224,SAMPLE,,,,750.000,ml,12,1.000
"Well Crafted Wine & Beverage Co.","LaMontagne Pinot Noir 2016",18202,SAMPLE,,,,750.000,ml,12,2.000
"Well Crafted Wine & Beverage Co.","LaMontagne Pinot Noir (Wine Club) 2015",17048,CAL1268,,,,750.000,ml,12,4.000
"Well Crafted Wine & Beverage Co.","Lanzarote Vino Blanco 2021",16861,SAMPLE,,,,750.000,ml,12,1.000
"Well Crafted Wine & Beverage Co.","Lanzarote Vino Rosado 2021",16864,SAMPLE,,,,750.000,ml,12,1.000
"Well Crafted Wine & Beverage Co.","Le Petit Jard Bordeaux (MD & DC) 2022",23934,FRA1158,,,13.00,750.000,ml,12,0.000
"Well Crafted Wine & Beverage Co.","Le Pletzl Red Bordeaux Mevushal (MD & DC) 2023",23847,FRA1149,,,,750.000,ml,12,0.000
"Well Crafted Wine & Beverage Co.","Le Prieur Entre-Deux-Mers White 2021",17774,FRA1003,,,,750.000,ml,12,1.000
"Well Crafted Wine & Beverage Co.","Le Prieur Entre-Deux-Mers White 2022",21333,FRA1003,,,,750.000,ml,12,2.000
"Well Crafted Wine & Beverage Co.","Le Prieur Entre-Deux-Mers White 2023",23308,FRA1003,,,14.00,750.000,ml,12,545.000
"Well Crafted Wine & Beverage Co.","Le Prieur Entre-Deux-Mers White 2024",28250,FRA1003,,,,750.000,ml,12,1080.000
"Well Crafted Wine & Beverage Co.","Leira Reyero Albarino 2023",24280,SPA1061,,,12.50,750.000,ml,12,68.000
"Well Crafted Wine & Beverage Co.","Les Brebis Eola Hills Pinot Noir 2018",10278,ORO1005,,,13.70,750.000,ml,12,8.000
"Well Crafted Wine & Beverage Co.","Les Brebis Ramato 2022",21499,ORO1049,,,12.50,750.000,ml,12,48.000
"Well Crafted Wine & Beverage Co.","Les Brebis Ramato 2023",25506,ORO1049,,,12.50,750.000,ml,12,468.000
"Well Crafted Wine & Beverage Co.","Les Brebis Willamette Pinot Noir 2018",3411,ORO1004,,,13.70,750.000,ml,12,1.000
"Well Crafted Wine & Beverage Co.","Les Brebis Willamette Pinot Noir 2019",11795,ORO1004,,,13.70,750.000,ml,12,4.000
"Well Crafted Wine & Beverage Co.","Les Brebis Willamette Pinot Noir 2023",25507,ORO1004,,,13.70,750.000,ml,12,587.000
"Well Crafted Wine & Beverage Co.","Les Bulles Blanches Cremant de Lorie Sparkling White",16991,,,,,750.000,ml,12,
"Well Crafted Wine & Beverage Co.","Les Bulles Rosees Cremant de Lorie Sparkling Rose",16990,,,,,750.000,ml,12,2.000
"Well Crafted Wine & Beverage Co.","Libertine Barncat Dry Riesling 2019",14537,ORO1019,,,,750.000,ml,12,2.000
"Well Crafted Wine & Beverage Co.","Libertine ""You Are Still Alive"" Pet-Nat 2022",22235,ORO1050,,,,750.000,ml,12,0.000
"Well Crafted Wine & Beverage Co.","Libertine Barncat Dry Riesling 2020",18118,ORO1019,,,,750.000,ml,12,28.000
"Well Crafted Wine & Beverage Co.","Libertine Chardetto 2022",21369,ORO1048,,,,750.000,ml,12,73.000
"Well Crafted Wine & Beverage Co.","Libertine Death & Rebirth",14538,ORO1036,,,,750.000,ml,12,4.000
"Well Crafted Wine & Beverage Co.","Libertine Dion Vineyards Carbonic Red Syrah III 2021",21384,ORO1045,,,11.00,750.000,ml,12,18.000
"Well Crafted Wine & Beverage Co.","Libertine Dion Vineyards Tempranillio ""You Are Still Alive"" 2021",21383,ORO1044,,,13.00,750.000,ml,12,90.000
"Well Crafted Wine & Beverage Co.","Libertine Gradient Vineyard Chardonnay 2022",21387,ORO1042,,,12.00,750.000,ml,12,94.000
"Well Crafted Wine & Beverage Co.","Libertine Late Harvest Riesling 2019",14540,ORO1035,,,15.00,750.000,ml,12,4.000
"Well Crafted Wine & Beverage Co.","Libertine Old Wagon Road Vineyard Chardonnay 2021",18117,ORO1043,,,12.00,750.000,ml,12,1.000
"Well Crafted Wine & Beverage Co.","Libertine Old Wagon Road Vineyard Chardonnay 2022",21386,ORO1043,,,12.00,750.000,ml,12,77.000
"Well Crafted Wine & Beverage Co.","Libertine One Heart Vineyard Albarino",14539,ORO1031,,,,750.000,ml,12,1.000
"Well Crafted Wine & Beverage Co.","Libertine Roam Red 2022",21385,ORO1033,,,12.00,750.000,ml,12,227.000
"Well Crafted Wine & Beverage Co.","Libertine Scheurebe 2021",16881,SAMPLE,,,,750.000,ml,12,
"Well Crafted Wine & Beverage Co.","Libertine You Are Still Alive 2020",16880,SAMPLE,,,,750.000,ml,12,
"Well Crafted Wine & Beverage Co.","Lolea Case Wrap",2968,,,,,,,,20.000
"Well Crafted Wine & Beverage Co.","Lolea Citrus Spritz",29255,SPA1359,,,8.00,750.000,ml,12,268.000
"Well Crafted Wine & Beverage Co.","Lolea Floral Spritz",29257,SPA1358,,,8.00,750.000,ml,12,179.000
"Well Crafted Wine & Beverage Co.","Lolea Valentine's Day Promo",11797,,,,,750.000,ml,,83.000
"Well Crafted Wine & Beverage Co.","Lolea Mini White   187 ml",2278,SPA1146,,,6.80,187.000,ml,24,1543.000
"Well Crafted Wine & Beverage Co.","Luchador Tempranillo 2022",28618,SPA1282,,,15.25,750.000,ml,12,186.000
"Well Crafted Wine & Beverage Co.","Lueria Gewurztraminer 2020",25322,ISR1036,,,12.50,750.000,ml,12,0.000
"Well Crafted Wine & Beverage Co.","Lueria Roussanne",25298,ISR1033,,,,750.000,ml,12,0.000
"Well Crafted Wine & Beverage Co.","Lueria Unoaked Chardonnay",25297,ISR1032,,,,750.000,ml,12,0.000
"Well Crafted Wine & Beverage Co.","Lueria Cabernet Sauvignon Mevushal (MD & DC) 2023",23931,ISR1015,,,14.50,750.000,ml,12,12.000
"Well Crafted Wine & Beverage Co.","Lueria Terrace  (MD & DC) 2023",24698,ISR1017,,,14.50,750.000,ml,12,0.000
"Well Crafted Wine & Beverage Co.","Luis Blanc Pergola Red (Wine Club Only) 2023",25514,FRA1171,,,,750.000,ml,12,264.000
"Well Crafted Wine & Beverage Co.","Luis Blanc Treilles White  (Wine Club Only) 2023",25515,FRA1172,,,,750.000,ml,12,60.000
"Well Crafted Wine & Beverage Co.","Macauley Bacigalupi Chardonnay 2023",29008,CAL1369,,,13.80,750.000,ml,12,18.000
"Well Crafted Wine & Beverage Co.","Macauley Cabernet Sauvignon Stagecoach 2021",29013,CAL1373,,,15.20,750.000,ml,12,46.000
"Well Crafted Wine & Beverage Co.","Macauley Cabernet Sauvignon To Kalon 2021",29014,CAL1375,,,15.10,750.000,ml,12,18.000
"Well Crafted Wine & Beverage Co.","Macauley Petite Sirah Napa Valley 2021",29012,CAL1377,,,15.60,750.000,ml,12,20.000
"Well Crafted Wine & Beverage Co.","Macauley Pinot Noir Fort Ross-Seaview 2022",29009,CAL1370,,,14.50,750.000,ml,12,0.000
"Well Crafted Wine & Beverage Co.","Macauley Napa Valley Cabernet Sauvignon 2022",28997,CAL1371,,,15.20,750.000,ml,12,12.000
"Well Crafted Wine & Beverage Co.","Maison Albert Signature Viognier White 2017",16994,,,,,750.000,ml,12,1.000
"Well Crafted Wine & Beverage Co.","Maison Ogier Cotes du Rhone Blanc 2024",30112,FRA1194,,,13.00,750.000,ml,12,263.000
"Well Crafted Wine & Beverage Co.","Maison Ogier Cotes du Rhone Rouge 2023",30111,FRA1193,,,14.50,750.000,ml,12,274.000
"Well Crafted Wine & Beverage Co.","Maison Ogier St. Joseph 2022",30114,FRA1196,,,13.50,750.000,ml,6,71.000
"Well Crafted Wine & Beverage Co.","Maison Ogier Vacqueyras 2023",30113,FRA1195,,,15.50,750.000,ml,12,107.000
"Well Crafted Wine & Beverage Co.","Maison Roche de Bellene Bourgogne Chardonnay Cuvee Reserve 2020",20724,FRA1107,,,,750.000,ml,12,8.000
"Well Crafted Wine & Beverage Co.","Maison Roche de Bellene Bourgogne Chardonnay Cuvee Reserve 2021",22780,FRA1107,,,,750.000,ml,12,82.000
"Well Crafted Wine & Beverage Co.","Maison Roche de Bellene Bourgogne Pinot Noir Cuvee Reserve 2022",27768,FRA1108,,,,750.000,ml,12,12.000
"Well Crafted Wine & Beverage Co.","Maison Roche de Bellene Gevrey Chambertin VV 2020",20727,FRA1110,,,13.50,750.000,ml,6,13.000
"Well Crafted Wine & Beverage Co.","Maison Roche de Bellene Meursault VV 2020",20726,FRA1109,,,13.50,750.000,ml,6,6.000
"Well Crafted Wine & Beverage Co.","Maison Ventenac Cuvee Marie 2021",17028,FRA1065,,,,750.000,ml,12,1.000
"Well Crafted Wine & Beverage Co.","Maison Ventenac Cuvee Marie 2022",21254,FRA1065,,,12.00,750.000,ml,12,23.000
"Well Crafted Wine & Beverage Co.","Maison Ventenac Cuvee Marie 2023",23646,FRA1065,,,12.00,750.000,ml,12,353.000
"Well Crafted Wine & Beverage Co.","Maison Ventenac Cuvee Marie 2024",28193,FRA1065,,,,750.000,ml,12,840.000
"Well Crafted Wine & Beverage Co.","Maison Ventenac Cuvee Pierre 2021",17026,FRA1066,,,,750.000,ml,12,1.000
"Well Crafted Wine & Beverage Co.","Maison Ventenac Cuvee Pierre 2023",23645,FRA1066,,,,750.000,ml,12,499.000
"Well Crafted Wine & Beverage Co.","Maison Ventenac Cuvee Pierre 2024",28196,FRA1066,,,,750.000,ml,12,180.000
"Well Crafted Wine & Beverage Co.","Maison Ventenac Cuvee Stephanie 2020",15063,FRA1068,,,,750.000,ml,12,0.000
"Well Crafted Wine & Beverage Co.","Maison Ventenac Cuvee Stephanie 2023",28195,FRA1068,,,,750.000,ml,12,259.000
"Well Crafted Wine & Beverage Co.","Maison Ventenac Diane Rose 2021",16977,FRA1076,,,11.50,750.000,ml,12,0.000
"Well Crafted Wine & Beverage Co.","Maison Ventenac L'intrus 2022",21216,FRA1067,,,13.00,750.000,ml,12,4.000
"Well Crafted Wine & Beverage Co.","Maison Ventenac L'intrus 2023",28194,FRA1067,,,13.00,750.000,ml,12,564.000
"Well Crafted Wine & Beverage Co.","Maison Ventenac Reserve de Jeanne 2020",23644,FRA1127,,,,750.000,ml,12,0.000
"Well Crafted Wine & Beverage Co.","Mallorca Gallinas & Focas Red 2014",3014,SPA1169,,,13.00,750.000,ml,12,
"Well Crafted Wine & Beverage Co.","Mallorca Gallinas & Focas Red 2015",4508,SPA1169,,,13.00,750.000,ml,12,
"Well Crafted Wine & Beverage Co.","Manchuela Bodegas Ponce Buena Pinta 2014",1553,SPA1047,,,13.00,750.000,ml,12,3.000
"Well Crafted Wine & Beverage Co.","Manchuela Bodegas Ponce Buena Pinta 2015",2033,SPA1047,,,13.00,750.000,ml,12,4.000
"Well Crafted Wine & Beverage Co.","Manchuela Bodegas Ponce Clos Lojen Bobal 2016",3077,SPA1046,,,13.00,750.000,ml,12,
"Well Crafted Wine & Beverage Co.","Manchuela Bodegas Ponce La Casilla",1163,SPA1048,,,14.00,750.000,ml,12,
"Well Crafted Wine & Beverage Co.","Manchuela Bodegas Ponce Reto 2014",1552,SPA1045,,,13.00,750.000,ml,12,
"Well Crafted Wine & Beverage Co.","Marina Alta Blanco 2023",25051,SPA1333,,,11.00,750.000,ml,12,324.000
"Well Crafted Wine & Beverage Co.","Marina Alta Blanco Coleccion 2022",25052,SPA1334,,,12.00,750.000,ml,12,534.000
"Well Crafted Wine & Beverage Co.","Martellotto Cabernet Sauvignon 2019",18200,SAMPLE,,,,750.000,ml,12,1.000
"Well Crafted Wine & Beverage Co.","Martellotto M Chardonnay (Wine Club) 2021",17047,CAL1267,,,,750.000,ml,12,1.000
"Well Crafted Wine & Beverage Co.","Martellotto M Grenache (Wine Club) 2020",17046,CAL1266,,,,750.000,ml,12,1.000
"Well Crafted Wine & Beverage Co.","Martellotto Red Blend 2017",18201,SAMPLE,,,,750.000,ml,12,1.000
"Well Crafted Wine & Beverage Co.","Martino Cabernet Franc 2019",18199,SAMPLE,,,,750.000,ml,12,1.000
"Well Crafted Wine & Beverage Co.","Martino Malbec 2019",18197,SAMPLE,,,,750.000,ml,12,1.000
"Well Crafted Wine & Beverage Co.","Martino Pedro Ximenez 2020",18196,SAMPLE,,,,750.000,ml,12,1.000
"Well Crafted Wine & Beverage Co.","Martino Sangiovese 2020",18198,SAMPLE,,,,750.000,ml,12,1.000
"Well Crafted Wine & Beverage Co.","Mate Mantus Merlot IGT Toscana 2021",22819,ITA1102,,,15.00,750.000,ml,12,113.000
"Well Crafted Wine & Beverage Co.","Mate Brunello di Montalcino 2018",22818,ITA1100,,,14.50,750.000,ml,12,41.000
"Well Crafted Wine & Beverage Co.","Mate Brunello di Montalcino 2019",27572,ITA1100,,,,750.000,ml,12,240.000
"Well Crafted Wine & Beverage Co.","Mate Mania Cabernet Sauvignon IGT Toscana 2021",22820,ITA1101,,,14.50,750.000,ml,12,4.000
"Well Crafted Wine & Beverage Co.","Mate Mania Cabernet Sauvignon IGT Toscana 2022",27573,ITA1101,,,14.50,750.000,ml,12,118.000
"Well Crafted Wine & Beverage Co.","Mauro Molino Barbera d'Alba 2021",17971,ITA1025,"Mauro Molino - Supplier",,14.50,750.000,ml,12,1.000
"Well Crafted Wine & Beverage Co.","Mauro Molino Barbera d'Alba 2022",22836,ITA1025,"Mauro Molino - Supplier",,14.50,750.000,ml,12,75.000
"Well Crafted Wine & Beverage Co.","Mauro Molino Barbera d'Alba 2024",29378,ITA1025,"Mauro Molino - Supplier",,14.50,750.000,ml,12,240.000
"Well Crafted Wine & Beverage Co.","Mauro Molino Barbera d'Asti DOCG Leradici 2022",24998,ITA1034,,,15.50,750.000,ml,12,252.000
"Well Crafted Wine & Beverage Co.","Mauro Molino Barolo 2020",23752,ITA1026,"Mauro Molino - Supplier",,14.50,750.000,ml,12,74.000
"Well Crafted Wine & Beverage Co.","Mauro Molino Barolo 2021",29382,ITA1026,"Mauro Molino - Supplier",,14.50,750.000,ml,12,108.000
"Well Crafted Wine & Beverage Co.","Mauro Molino Barolo (375 ml) 2019  375 ml",21539,ITA1044,"Mauro Molino - Supplier",,14.00,375.000,ml,12,0.000
"Well Crafted Wine & Beverage Co.","Mauro Molino Barolo (Stained Label) 2019",23245,ITA1026,"Mauro Molino - Supplier",,14.50,750.000,ml,12,1.000
"Well Crafted Wine & Beverage Co.","Mauro Molino Barolo Bricco Luciani 2020",23754,ITA1030,"Mauro Molino - Supplier",,14.00,750.000,ml,12,3.000
"Well Crafted Wine & Beverage Co.","Mauro Molino Barolo Bricco Luciani 2021",29383,ITA1030,"Mauro Molino - Supplier",,14.00,750.000,ml,12,54.000
"Well Crafted Wine & Beverage Co.","Mauro Molino Barolo Conca 2020",23755,ITA1031,"Mauro Molino - Supplier",,14.00,750.000,ml,12,44.000
"Well Crafted Wine & Beverage Co.","Mauro Molino Barolo Gallinotto 2020",23753,ITA1027,"Mauro Molino - Supplier",,14.00,750.000,ml,12,1.000
"Well Crafted Wine & Beverage Co.","Mauro Molino Barolo Gallinotto 2021",29379,ITA1027,"Mauro Molino - Supplier",,14.00,750.000,ml,12,159.000
"Well Crafted Wine & Beverage Co.","Mauro Molino Barolo La Serra 2020",23756,ITA1111,,,,750.000,ml,12,11.000
"Well Crafted Wine & Beverage Co.","Mauro Molino Langhe Dolcetto 2018",6028,ITA1023,"Mauro Molino - Supplier",,13.50,750.000,ml,12,4.000
"Well Crafted Wine & Beverage Co.","Mauro Molino Langhe Dolcetto 2021",19541,ITA1023,"Mauro Molino - Supplier",,13.50,750.000,ml,12,1.000
